{
  "$schema": "http://json-schema.org/schema#",
  "title": "Validator for misp-warninglists",
  "id": "https://www.github.com/MISP/misp-warninglists/schema.json",
  "type": "object",
  "additionalProperties": false,
  "properties": {
    "description": {
      "type": "string"
    },
    "name": {
      "type": "string"
    },
    "version": {
      "type": "integer"
    },
    "list": {
      "type": "array",
      "uniqueItems": true,
      "items": {
        "type": "string"
      }
    },
    "type": {
      "type": "string",
      "enum": [
        "string",
        "substring",
        "hostname",
        "cidr"
      ]
    },
    "matching_attributes": {
      "type": "array",
      "uniqueItems": true,
      "items": {
        "type": "string"
      }
    }
  },
  "required": [
    "list",
    "description",
    "version",
    "name",
    "type"
  ]
}
