{
  "name": "List of known domains used by automated malware analysis services & security vendors",
  "version": 3,
  "description": "Domains used by automated malware analysis services & security vendors",
  "type": "substring",
  "matching_attributes": [
    "domain",
    "hostname",
    "domain|ip",
    "url"
  ],
  "list": [
    "virustotal.com",
    "malwr.com",
    "hybrid-analysis.com",
    "emergingthreats.net",
    "joesandbox.com",
    "anlyz.io",
    "detux.org",
    "akana.mobiseclab.org",
    "sandbox.pikker.ee",
    "www.threatexpert.com",
    "www.vicheck.ca",
    "reverse.it",
    "mcafee.com",
    "symantec.com",
    "securelist.com",
    "carbonblack.com",
    "app.any.run"
  ]
}
