{
  "name": "List of known URL Shorteners domains",
  "version": 6,
  "description": "Event contains one or more entries of known Shorteners domains",
  "matching_attributes": [
    "domain",
    "hostname",
    "domain|ip",
    "url",
    "uri"
  ],
  "type": "hostname",
  "list": [
    "1url.com",
    "adcraft.co",
    "adcrun.ch",
    "adflav.com",
    "adf.ly",
    "aka.gr",
    "amzn.to",
    "bc.vc",
    "bee4.biz",
    "bit.do",
    "bit.ly",
    "bitly.com",
    "buff.ly",
    "buzurl.com",
    "cektkp.com",
    "cur.lv",
    "cut.by",
    "cutt.us",
    "db.tt",
    "dft.ba",
    "filoops.info",
    "fun.ly",
    "fzy.co",
    "gog.li",
    "golinks.co",
    "goo.gl",
    "hit.my",
    "hyperurl.co",
    "id.tl",
    "iplogger.com",
    "is.gd",
    "ity.im",
    "j.mp",
    "linkto.im",
    "link.zip.net",
    "lnk.co",
    "lnk.direct",
    "lnkd.in",
    "mcaf.ee",
    "nov.io",
    "ow.ly",
    "p6l.org",
    "picz.us",
    "po.st",
    "prettylinkpro.com",
    "q.gs",
    "qr.ae",
    "qr.net",
    "scrnch.me",
    "shortquik.com",
    "sk.gy",
    "smarturl.it",
    "snip.ly",
    "su.pr",
    "s.rlp.de",
    "t.co",
    "tinyarrows.com",
    "tiny.cc",
    "tinyurl.com",
    "tota2.com",
    "tr.im",
    "tweez.me",
    "twitthis.com",
    "u.bb",
    "urlz.fr",
    "u.to",
    "v.gd",
    "vzturl.com",
    "wp.me",
    "x.co",
    "xlinkz.info",
    "xtu.me",
    "yourls.org",
    "youtu.be",
    "yu2.it",
    "zpag.es",
    "iplogger.org"
  ]
}
